<?xml version="1.0" encoding="UTF-8"?>

<!ELEMENT USERS (USER)*>
<!ELEMENT USER (USERNAME|PASSWORD|USERROLE)*>
<!ELEMENT USERNAME (#PCDATA)>
<!ELEMENT PASSWORD (#PCDATA)>
<!ELEMENT USERROLE (#PCDATA)>
